<!ELEMENT listaventas (venta+)>
    <!ELEMENT venta (importe,comprador,vendedor,fecha?,codFactura)>
    <!ELEMENT importe (#PCDATA)>
    <!ELEMENT comprador (#PCDATA)>
    <!ELEMENT vendedor (#PCDATA)>
    <!ELEMENT fecha (#PCDATA)>
    <!ELEMENT codFactura (#PCDATA)>